{
  "authority_level": "authoritative_internal",
  "direct_or_inferred": "direct",
  "extracted_fact": "Term 'Settlement Date'; definition: 'The date on which cash and securities are exchanged to complete a trade.'; owner Avery Example (SYNTHETIC); status Approved; version 1.0; recorded_cde_flag true.",
  "location": "SYNTH-GLOSSARY/GL-101",
  "source_id": "GL-101",
  "source_type": "glossary_term",
  "timestamp": "2026-10-28T00:00:00Z",
  "title": "Settlement Date"
}
