{
  "authority_level": "authoritative_internal",
  "direct_or_inferred": "direct",
  "extracted_fact": "The internal grouping of a counterparty by credit and relationship standing.",
  "location": "SYNTH-GLOSSARY/GL-401",
  "source_id": "GL-401",
  "source_type": "glossary_term",
  "timestamp": "2026-10-28T00:00:00Z",
  "title": "Counterparty Tier"
}
